{
  "$schema": "https://json-schema.org/draft/2020-12/schema",
  "$id": "https://schemas.localwaves.dev/agency-os-bridge/v1/pipeline-schedule.request.json",
  "title": "pipeline-schedule (v1.3.0, allowOsPublish)",
  "description": "Schedule the publish (client_approved -> scheduled). Same actor/override rules as pipeline-publish; the emdash-seo beforeSchedule gate runs now and the publish gate runs again at publish time. at: future, <= 365 days ahead.",
  "type": "object",
  "properties": {
    "reviewId": {
      "$ref": "common.json#/$defs/id"
    },
    "at": {
      "$ref": "common.json#/$defs/dateTime"
    },
    "expectedRev": {
      "type": "integer",
      "minimum": 1
    },
    "actor": {
      "type": "object",
      "properties": {
        "kind": {
          "const": "human"
        },
        "osUserId": {
          "$ref": "common.json#/$defs/uuid"
        },
        "name": {
          "type": "string",
          "maxLength": 200
        },
        "role": {
          "enum": [
            "OWNER",
            "PM"
          ]
        }
      },
      "required": [
        "kind",
        "osUserId",
        "name",
        "role"
      ]
    },
    "override": {
      "type": "boolean"
    },
    "overrideReason": {
      "type": "string",
      "minLength": 20,
      "maxLength": 1000
    }
  },
  "required": [
    "reviewId",
    "at",
    "actor"
  ],
  "allOf": [
    {
      "if": {
        "properties": {
          "override": {
            "const": true
          }
        },
        "required": [
          "override"
        ]
      },
      "then": {
        "required": [
          "overrideReason"
        ],
        "properties": {
          "actor": {
            "properties": {
              "role": {
                "const": "OWNER"
              }
            }
          }
        }
      }
    }
  ]
}
